COMMENT_ID,AUTHOR,DATE,CONTENT,SUMMARY,LIKE_COUNT,CLASS
UgyY26AlbgXm-zKGM3V4AaABAg,@zombiehorsefranzferdinand9304,2021-05-14T23:04:34Z,How was a Russia a WW1 winner?,"OverSimplified's ""WW2"" series offers an entertaining and educational take on World War II. Part 1 delves into the origins of the conflict, key players like Hitler and Churchill, and major events leading to the war's outbreak. Using humor and simplified explanations, the video makes history engaging and accessible.",2,0
UgxIT9hLEQ_QeneZ1Gl4AaABAg,@luismedellin5723,2021-05-13T02:06:21Z,"The winner tells the story, the winner would never say anything to make it seem like there’re in the wrong.","OverSimplified's ""WW2"" series offers an entertaining and educational take on World War II. Part 1 delves into the origins of the conflict, key players like Hitler and Churchill, and major events leading to the war's outbreak. Using humor and simplified explanations, the video makes history engaging and accessible.",0,0
UgwYHRLDjCMSUbBrumR4AaABAg,@unqualifiedthinking,2021-05-12T00:39:54Z,"You fool you absolute buffoon<br>Welcome to the monke Movement, monke.<br>Because you DM&#39;ed me “monke” you must do the following:<br><br>1. Put dm me the word monke into your status<br>2. If anyone dms you saying monke, send them this<br>3. Monke<br><br>I was infected<br>The infection stays for a week.","OverSimplified's ""WW2"" series offers an entertaining and educational take on World War II. Part 1 delves into the origins of the conflict, key players like Hitler and Churchill, and major events leading to the war's outbreak. Using humor and simplified explanations, the video makes history engaging and accessible.",0,0
Ugx_tjBpc575Vh-wGNx4AaABAg,@lordchikage9015,2021-04-27T09:22:10Z,"World war 2 only happened because people really thought that a world war can have winners 🙄. There are only losers, mostly the civilians. And letting Germany pay for everything was the dumbest decision in human history.","OverSimplified's ""WW2"" series offers an entertaining and educational take on World War II. Part 1 delves into the origins of the conflict, key players like Hitler and Churchill, and major events leading to the war's outbreak. Using humor and simplified explanations, the video makes history engaging and accessible.",0,0
UgwqQVfJmr6YL22UL8Z4AaABAg,@jabzudah4251,2021-03-29T20:05:50Z,"<a href=""https://www.youtube.com/watch?v=_uk_6vfqwTA&amp;t=772"">12:52</a> “Churchill ordered a pretty insignificant bombing of Berlin” <br><br>This was also the Dresden bombings in which 500,000 Germans (mostly civilians) were killed, Hitler in a bid to gain revenge for the fatherland and to not lose face in the eyes of the public whom (at this stage) adored him, switched focus from RAF and other military operation over to civilian bombings ie the blitz and Close county bombings. <br><br>To say this Berlin bombings were “insignificant” could...I don’t know.... maybe be a bit winner biased ?","OverSimplified's ""WW2"" series offers an entertaining and educational take on World War II. Part 1 delves into the origins of the conflict, key players like Hitler and Churchill, and major events leading to the war's outbreak. Using humor and simplified explanations, the video makes history engaging and accessible.",0,0
UgxngdcknpNMjDvt8CB4AaABAg,@grum3660,2021-03-28T22:00:49Z,"About Appeasement which is something commonly misunderstood. Appeasement was never meant to stop war with Germany, it was to build up military strength. The British and French were extremely weak with their populous unwilling to send it&#39;s children to another war.","OverSimplified's ""WW2"" series offers an entertaining and educational take on World War II. Part 1 delves into the origins of the conflict, key players like Hitler and Churchill, and major events leading to the war's outbreak. Using humor and simplified explanations, the video makes history engaging and accessible.",0,0
Ugx5Gx3iQq1rAKoQyRN4AaABAg,@shinra.9140,2021-03-28T20:00:49Z,join this server or imma send the fbi to you: @t,"OverSimplified's ""WW2"" series offers an entertaining and educational take on World War II. Part 1 delves into the origins of the conflict, key players like Hitler and Churchill, and major events leading to the war's outbreak. Using humor and simplified explanations, the video makes history engaging and accessible.",0,1
UgzFXGPYETYS6pP1ARt4AaABAg,@shinra.9140,2021-03-28T19:42:39Z,join this server or imma send the fbi to you: @t,"OverSimplified's ""WW2"" series offers an entertaining and educational take on World War II. Part 1 delves into the origins of the conflict, key players like Hitler and Churchill, and major events leading to the war's outbreak. Using humor and simplified explanations, the video makes history engaging and accessible.",0,1
Ugx0qCVsCQVHWiyxAWx4AaABAg,@ivanobuhovac8067,2021-03-27T13:25:19Z,USA was also on the winners side of WWI and Bulgaria was on the losers side ofWWI,"OverSimplified's ""WW2"" series offers an entertaining and educational take on World War II. Part 1 delves into the origins of the conflict, key players like Hitler and Churchill, and major events leading to the war's outbreak. Using humor and simplified explanations, the video makes history engaging and accessible.",0,0
UgwOf8pw_WQPEOGHKPV4AaABAg,@moreauclement9702,2021-03-09T09:57:04Z,"The head of military of France did not move on from the WW1 as stated in this video and didn&#39;t take account of some of the younger officer (like a certain Lt De Gaulle but not only) who warned them that the Ardennes wasn&#39;t that naturally impenetrable and that even if our tanks were not so outdated (in fact they were pretty modern for that time) we didn&#39;t had enough of it. And our aviation was lacking as well.<br><br>And then, while Hitler had learned the lesson of the WW1, we didn&#39;t. And we were steamrolled. <br><br>Thankfully, and they had no reason to do so objectively speaking, our (ex-)colonies did not surrender and continued the fight, rejoigned with some Metropolitan soldier who fled the occupied France while others fled to UK, helping the little resistance still on land. That&#39;s how we are historically considered as winner but factually one of the most humiliating defeat France has suffered. <br><br>NB : Sorry for te baguette english","OverSimplified's ""WW2"" series offers an entertaining and educational take on World War II. Part 1 delves into the origins of the conflict, key players like Hitler and Churchill, and major events leading to the war's outbreak. Using humor and simplified explanations, the video makes history engaging and accessible.",0,0
UgzIKtUg89lgwzxL4yF4AaABAg,@petarsmakic7346,2021-02-21T09:39:47Z,"You forgot to mention Serbia as WW1 winner , we fought AustroHungary very well and lost 30% of population","OverSimplified's ""WW2"" series offers an entertaining and educational take on World War II. Part 1 delves into the origins of the conflict, key players like Hitler and Churchill, and major events leading to the war's outbreak. Using humor and simplified explanations, the video makes history engaging and accessible.",0,0
UgyJ8c9fqZulZkxKI1Z4AaABAg,@yannickfrogel3537,2021-02-20T23:42:14Z,"Actually the winner of the first world war are indirect responsible for the second one. They economically destroyed and humiliated Germany. This was the reason a populist like Hitler was able to control the country and if not him, somebody else would have with extrem political thoughts.","OverSimplified's ""WW2"" series offers an entertaining and educational take on World War II. Part 1 delves into the origins of the conflict, key players like Hitler and Churchill, and major events leading to the war's outbreak. Using humor and simplified explanations, the video makes history engaging and accessible.",1,0
UgyTG1jk6Lb8Wuiw4qt4AaABAg,@yizhuwang852,2021-02-12T21:17:59Z,Me: HiSTrOy Is ThE WoRSt ThInG EvER<br>Me after this: 1 click delete every other subject.,"OverSimplified's ""WW2"" series offers an entertaining and educational take on World War II. Part 1 delves into the origins of the conflict, key players like Hitler and Churchill, and major events leading to the war's outbreak. Using humor and simplified explanations, the video makes history engaging and accessible.",34,0
UgynOczp-kaHdMM_GOh4AaABAg,@eve0383,2021-02-10T16:39:32Z,"<a href=""https://www.youtube.com/watch?v=_uk_6vfqwTA&amp;t=660"">11:00</a> excuse me what? I&#39;ve never heard of the tactic &quot;send refugees toward the enemy to slow them down&quot;. The Blitzkrieg- tactic is simply the coordinated attack of mechanized, and infantry troops with air cover. <br>I would be very interested where you got that from.","OverSimplified's ""WW2"" series offers an entertaining and educational take on World War II. Part 1 delves into the origins of the conflict, key players like Hitler and Churchill, and major events leading to the war's outbreak. Using humor and simplified explanations, the video makes history engaging and accessible.",0,0
UgwFBrgf1uYV8z0eAG94AaABAg,@Rediscovered,2021-02-10T14:34:07Z,"The one thing I took away from this is that everyones action are fully rational and logically motivated. I mean, everyone wants to be a winner, right? It&#39;s either that or being treated like second class. So you go out and take the win, or die trying.","OverSimplified's ""WW2"" series offers an entertaining and educational take on World War II. Part 1 delves into the origins of the conflict, key players like Hitler and Churchill, and major events leading to the war's outbreak. Using humor and simplified explanations, the video makes history engaging and accessible.",1,0
UgzlSgOZ4EQ8bWlKtCd4AaABAg,@Rockgirlloveskrillex,2021-01-27T13:36:09Z,i hate myself for clicking in this ad,"OverSimplified's ""WW2"" series offers an entertaining and educational take on World War II. Part 1 delves into the origins of the conflict, key players like Hitler and Churchill, and major events leading to the war's outbreak. Using humor and simplified explanations, the video makes history engaging and accessible.",0,0
UgwoE9UJzXS1KawPvvR4AaABAg,@MastersTMC,2021-01-05T09:28:49Z,i cant believe what did just the teacher send us to where,"OverSimplified's ""WW2"" series offers an entertaining and educational take on World War II. Part 1 delves into the origins of the conflict, key players like Hitler and Churchill, and major events leading to the war's outbreak. Using humor and simplified explanations, the video makes history engaging and accessible.",13,0
Ugy9S9GTInHSvwh1gOB4AaABAg,@nocontentnocomment2166,2020-12-11T10:26:34Z,No offence but Montenegro and Serbia were also winners,"OverSimplified's ""WW2"" series offers an entertaining and educational take on World War II. Part 1 delves into the origins of the conflict, key players like Hitler and Churchill, and major events leading to the war's outbreak. Using humor and simplified explanations, the video makes history engaging and accessible.",1,0
UgzqpTUky_De3EfTkHx4AaABAg,@lyfty7598,2020-12-09T16:01:30Z,I just clicked randomly and i just could not stop watching,"OverSimplified's ""WW2"" series offers an entertaining and educational take on World War II. Part 1 delves into the origins of the conflict, key players like Hitler and Churchill, and major events leading to the war's outbreak. Using humor and simplified explanations, the video makes history engaging and accessible.",0,0
